{
  "schemaVersion": "race.strategy-profile.v1",
  "profileId": "anti-aggressive-v1",
  "status": "candidate",
  "description": "对攻场景的 Ranger 偏置候选；源自 TS 对打实验，全 Ranger 仅作为待复核策略而非生产默认。",
  "posture": "balanced",
  "workerTarget": 8,
  "populationCeiling": 19,
  "militaryRatio": 0.4,
  "vanguardRatio": 0.0,
  "accumulateThreshold": 20,
  "attackForce": 5,
  "exploreRadius": 32,
  "maxFocusDistance": 24,
  "threatDistance": 8,
  "spawnReserve": 1,
  "attackPriority": "nearest",
  "resourceMemory": {
    "maxAgeTicks": 32,
    "failedCooldownTicks": 32
  },
  "exploration": {
    "ringStep": 8,
    "ringCount": 4,
    "directionStride": 3,
    "chunkAgeWeight": 1.0
  },
  "safety": {
    "clearPath": true,
    "enableCoreMigration": false
  }
}
